{
  "family": "Over Ceiling",
  "files": [
    { "role": "upright", "file": "font-over-ceiling-variable-latin.woff2", "weight": "400", "style": "normal", "bytes": 209920 }
  ],
  "license": "OFL-1.1",
  "sourceUrl": "https://example.com/font-over-ceiling",
  "version": "1.000",
  "subset": "latin"
}
