{
  "family": "Stowaway Asset",
  "files": [
    { "role": "upright", "file": "font-stowaway-asset-variable-latin.woff2", "weight": "400", "style": "normal", "bytes": 102 }
  ],
  "license": "OFL-1.1",
  "sourceUrl": "https://example.com/font-stowaway-asset",
  "version": "1.000",
  "subset": "latin"
}
