{
  "family": "Orphan Manifest",
  "files": [
    { "role": "upright", "file": "font-orphan-manifest-variable-latin.woff2", "weight": "400", "style": "normal", "bytes": 100 }
  ],
  "license": "OFL-1.1",
  "sourceUrl": "https://example.com/font-orphan-manifest",
  "version": "1.000",
  "subset": "latin"
}
