{
  "family": "Duplicate Asset",
  "files": [
    { "role": "upright", "file": "font-duplicate-asset-variable-latin.woff2", "weight": "400", "style": "normal", "bytes": 106 },
    { "role": "italic", "file": "font-duplicate-asset-variable-latin.woff2", "weight": "400", "style": "italic", "bytes": 106 }
  ],
  "license": "OFL-1.1",
  "sourceUrl": "https://example.com/font-duplicate-asset",
  "version": "1.000",
  "subset": "latin"
}
